{
  "confirmerPresent": true,
  "confirmers": 1,
  "subscribers": 2,
  "timeoutMs": 120000,
  "pending": [
    {
      "id": "018f3b1c-1111-7c3e-9f2b-1d4e5f6a7b8d",
      "capability": "proxy.subscription.add",
      "risk": "dangerous",
      "requestedAt": "2026-08-05T04:10:00.000Z",
      "expiresAt": "2026-08-05T04:12:00.000Z"
    }
  ]
}
